<?xml version="1.0" encoding="UTF-8"?>
<xsd:schema xmlns:xsd="http://www.w3.org/2001/XMLSchema">
	<xsd:element name="statuses">
		<xsd:complexType>
			<xsd:sequence>
				<xsd:element name="status" type="Status" minOccurs="6" maxOccurs="6"/>
			</xsd:sequence>
		</xsd:complexType>
	</xsd:element>
	<xsd:complexType name="Status">
		<xsd:sequence>
			<xsd:element name="name" type="xsd:string"/>
		</xsd:sequence>
		<xsd:attribute name="id" type="xsd:int" use="required"/>
	</xsd:complexType>
</xsd:schema>