<?xml version="1.0" encoding="UTF-8"?>
<statuses xmlns:xsi="http://www.w3.org/2001/XMLSchema-instance" xsi:noNamespaceSchemaLocation="xsd/Statuses.xsd">
  <status id="1">
    <name>New</name>
  </status>
  <status id="2">
    <name>Assigned</name>
  </status>
  <status id="3">
    <name>In Progress</name>
  </status>
  <status id="4">
    <name>Resolved</name>
  </status>
  <status id="5">
    <name>Closed</name>
  </status>
  <status id="6">
    <name>Reopened</name>
  </status>
</statuses>
